{
  "schemaVersion": "1.0",
  "id": "task-001",
  "parentId": null,
  "principalRef": "synthetic-persona-quiet-builder",
  "delegationChain": [],
  "kind": "CREATE_ARTICLE_DRAFT",
  "intent": "Turn one thought into a local article draft",
  "inputRefs": ["evidence://thought/001"],
  "evidenceRefs": ["evidence://thought/001"],
  "modalities": ["text"],
  "dataClass": "PERSONAL",
  "risk": "REVERSIBLE",
  "latencyClass": "INTERACTIVE",
  "requiredTools": ["local-draft-writer"],
  "outputSchema": "urn:emergeos:output:article-draft:v1",
  "acceptanceChecks": ["draft preserves the original thought"],
  "allowParallel": false,
  "maxModelSteps": 2,
  "maxToolCalls": 1,
  "deadlineMs": 30000,
  "budgetUsd": 0,
  "idempotencyKey": "task-001-attempt-001",
  "policyVersion": "policy-1",
  "stateVersion": "state-1",
  "contextPolicyVersion": "context-policy-1",
  "toolRegistryVersion": "tools-1",
  "environmentSnapshotRef": null,
  "capabilityRefs": ["capability://local-draft"],
  "unresolvedDecisions": [],
  "returnControlWhen": "approval is required"
}
