{
  "schemaVersion": "1.1",
  "id": "task-model-bound-001",
  "parentId": null,
  "principalRef": "synthetic-eval-owner",
  "delegationChain": [],
  "kind": "MODEL_EVAL",
  "intent": "Evaluate one frozen synthetic prompt",
  "inputRefs": ["capture://synthetic-model-eval"],
  "evidenceRefs": [],
  "modalities": ["text"],
  "dataClass": "PUBLIC",
  "risk": "READ_ONLY",
  "latencyClass": "INTERACTIVE",
  "requiredTools": ["capture.read"],
  "outputSchema": "urn:emergeos:schema:internal:agent-draft-proposal:v1",
  "acceptanceChecks": ["uses only frozen synthetic evidence"],
  "allowParallel": false,
  "maxModelSteps": 2,
  "maxToolCalls": 1,
  "deadlineMs": 30000,
  "budgetUsd": 0.01,
  "modelProvider": "openai.responses",
  "modelRequested": "gpt-5.6-sol",
  "pricingProfile": "openai-gpt-5.6-sol-2026-07-v1",
  "idempotencyKey": "synthetic-openai-eval-001",
  "policyVersion": "synthetic-model-egress-policy-v1",
  "stateVersion": "stage2-s3",
  "contextPolicyVersion": "ref-only-v1",
  "toolRegistryVersion": "agent-tools-v1",
  "environmentSnapshotRef": "environment://sha256:aaaaaaaaaaaaaaaaaaaaaaaaaaaaaaaaaaaaaaaaaaaaaaaaaaaaaaaaaaaaaaaa",
  "capabilityRefs": ["capability://model-egress/synthetic-openai-v1"],
  "unresolvedDecisions": [],
  "returnControlWhen": "structured final or non-success"
}
